ID,Posted at,Screen name,Text
456146728782004224,2014-04-15 19:07:09 +0000,ProTVChisinau,FOTO. Ea este Miss Moldova 2014. Cum arata tanara care ne va reprezenta tara la Miss World… http://t.co/SrFiOSPTXt
456123401862938624,2014-04-15 17:34:28 +0000,ProTVChisinau,Inca un dosar penal in Parlament. Nicolae Juravschi este cercetat penal. Vezi motivul… http://t.co/vh2yun7uQn
456115725250605056,2014-04-15 17:03:57 +0000,ProTVChisinau,"Tuberculoza face ravagii in scoli. Inca 16 copii din Falesti, INFECTATI. Autoritatile: ""Este… http://t.co/fZrvSsTk64"
456115724566941697,2014-04-15 17:03:57 +0000,ProTVChisinau,"Paste in stil italian. Moldovenii de peste hotare se grabesc sa trimita cadouri rudelor: ""Cum… http://t.co/MSCMueRT9V"
456115723900055552,2014-04-15 17:03:57 +0000,ProTVChisinau,De Paste se FURA iezi si miei. Ce a patit un batran dintr-o localitate din regiunea… http://t.co/XpyEYmnVI3
456115720607510529,2014-04-15 17:03:56 +0000,ProTVChisinau,102 ani de cand s-a scufundat Titanicul si peste 1500 de oameni s-au inecat: Titanicul a… http://t.co/d0DXXNgatK
456115720020295680,2014-04-15 17:03:56 +0000,ProTVChisinau,Profit din 15 aprilie. Moscova ar putea majora importurile de carne din Moldova: Fermierii… http://t.co/gN50GXsivB
456107922800787458,2014-04-15 16:32:57 +0000,ProTVChisinau,"Cele 3 vagoane care au ars, ar fi fost incendiate INTENTIONAT. Ce spune politia: Focul s-a… http://t.co/6iJHZCuWi9"
456107921471201280,2014-04-15 16:32:57 +0000,ProTVChisinau,"Pauza de 20 de zile pentru protestele profesorilor. Iurie Leanca: ""Vom discuta si vom gasi o… http://t.co/z183j2n3Gq"
456107920728793088,2014-04-15 16:32:57 +0000,ProTVChisinau,"Un inspector de la FISC, RETINUT de ofiterii CNA in timp ce lua mita. Ce risca: Potrivit… http://t.co/F5WSpKVFke"
456107919772504064,2014-04-15 16:32:56 +0000,ProTVChisinau,"Batranii o suta, iar deputatii de 5 ori mai mult. Cati bani vor primi pensionarii in ajun de… http://t.co/eLXIzRk5gr"
456107918841372672,2014-04-15 16:32:56 +0000,ProTVChisinau,"Ministerul de Externe: ""Atentionam cetatenii RM sa evite calatoriile in Ucraina"": Intr-un… http://t.co/mhqofNpCi3"
456093169092808705,2014-04-15 15:34:19 +0000,ProTVChisinau,"Debut perfect pentru noul antrenor, Stanislav Cercesov. Cum a umilit-o Dinamo Moscova pe… http://t.co/U0ZBFT1wKR"
456092666099683328,2014-04-15 15:32:20 +0000,ProTVChisinau,Primadona estradei ruse Alla Pugaciova implineste 65 de ani. Ce cadouri a primit interpreta… http://t.co/FRKCrYDX7C
456092594184142848,2014-04-15 15:32:02 +0000,ProTVChisinau,Stirile Pro TV de la ora 17:00 cu Anisoara Loghin - 15.04.14: DE DRAGUL IUBIRII O tanara de… http://t.co/w8ZYCPvcX9
456092593403985921,2014-04-15 15:32:02 +0000,ProTVChisinau,Juventus se apropie de titlul cu numarul 30 in Italia. Cum a batut-o pe Udinese: Batrana… http://t.co/fEdtVn9x9q
456092592707739648,2014-04-15 15:32:02 +0000,ProTVChisinau,"Memphis, pe ultimul loc in etapa urmatoarea din NBA. Care sunt echipele calificate in… http://t.co/CBzdjDXqzf"
456092591931793408,2014-04-15 15:32:02 +0000,ProTVChisinau,Primele probe eliminatorii la Masterchef. La ce teste dificile vor fi supusi concurentii… http://t.co/aov6QCtKaD
